"ticker","name"
"A","Agilent Technologies Inc."
"AA","Alcoa Corporation"
"AAA","Alternative Access First Priority CLO Bond ETF"
"AAAU","Goldman Sachs Physical Gold ETF Shares"
"AACB","Artius II Acquisition Inc. Class A Ordinary Shares"
"AACBR","Artius II Acquisition Inc. Rights"
"AACBU","Artius II Acquisition Inc. Units"
"AACG","ATA Creativity Global American Depositary Shares"
"AACIU","Armada Acquisition Corp. II Units"
"AACT","Ares Acquisition Corporation II"
"AACT.U","Ares Acquisition Corporation II Units, each consisting of one Class A ordinary share and one-half of one redeemable warrant"
"AACT.WS","Ares Acquisition Corporation II Redeemable Warrants, each whole warrant exercisable for one Class A ordinary share at an exercise price of $11.50"
"AADR","AdvisorShares Dorsey Wright ADR ETF"
"AAL","American Airlines Group Inc."
"AAM","AA Mission Acquisition Corp."
"AAM.U","AA Mission Acquisition Corp. Units, each consisting of one Class A Ordinary Share and one-half of one redeemable warrant"
"AAM.WS","AA Mission Acquisition Corp. Warrants, each whole warrant entitles the holder to purchase one Class A ordinary share at a price of $11.50 per share"
"AAME","Atlantic American Corp"
"AAMI","Acadian Asset Management Inc."
"AAOI","Applied Optoelectronics, Inc."
"AAON","Aaon Inc"
"AAP","ADVANCE AUTO PARTS INC"
"AAPB","GraniteShares ETF Trust GraniteShares 2x Long AAPL Daily ETF"
"AAPD","Direxion Daily AAPL Bear 1X Shares"
"AAPG","Ascentage Pharma Group International American Depository Shares"
"AAPL","Apple Inc."
"AAPR","Innovator Equity Defined Protection ETF - 2 Yr to April 2026"
"AAPU","Direxion Shares ETF Trust Direxion Daily AAPL Bull 2X Shares"
"AAPW","Roundhill AAPL WeeklyPay ETF"
"AAPX","T-Rex 2X Long Apple Daily Target ETF"
"AAPY","Kurv Yield Premium Strategy Apple (AAPL) ETF"
"AARD","Aardvark Therapeutics, Inc. Common Stock"
"AAT","AMERICAN ASSETS TRUST, INC."
"AAVM","EA Series Trust Alpha Architect Global Factor Equity ETF"
"AAXJ","iShares MSCI All Country Asia ex Japan ETF"
"AAXJ","iShares MSCI All Country Asia ex Japan ETF"
"AAXN","Axon Enterprise, Inc. Common Stock"
"AB","AllianceBernstein Holding, L.P."
"ABAT","American Battery Technology Company Common Stock"
"ABBV","ABBVIE INC."
"ABC","AMERISOURCEBERGEN CORP"
"ABCB","Ameris Bancorp"
"ABCL","AbCellera Biologics Inc. Common Shares"
"ABCS","Alpha Blue Capital US Small-Mid Cap Dynamic ETF"
"ABEO","Abeona Therapeutics Inc. Common Stock"
"ABEQ","Absolute Select Value ETF"
"ABEV","AMBEV S.A."
"ABFL","Abacus FCF Leaders ETF"
"ABG","Asbury Automotive Group, Inc."
"ABHY","Abacus Tactical High Yield ETF"
"ABIG","Argent Large Cap ETF"
"ABL","Abacus Global Management, Inc. Class A Common Stock"
"ABLD","Abacus FCF Real Assets Leaders ETF"
"ABLG","Abacus FCF International Leaders ETF"
"ABLLL","Abacus Global Management, Inc. 9.875% Fixed Rate Senior Notes due 2028"
"ABLLW","Abacus Global Management, Inc. Warrant"
"ABLS","Abacus FCF Small Cap Leaders ETF"
"ABLV","Able View Global Inc. Class B Ordinary Shares"
"ABLVW","Able View Global Inc. Warrant"
"ABM","ABM Industries, Inc."
"ABNB","Airbnb, Inc. Class A Common Stock"
"ABNY","YieldMax ABNB Option Income Strategy ETF"
"ABOS","Acumen Pharmaceuticals, Inc. Common Stock"
"ABOT","Abacus FCF Innovation Leaders ETF"
"ABP","Abpro Holdings, Inc Common Stock"
"ABPWW","Abpro Holdings, Inc. Warrant"
"ABR","Arbor Realty Trust, Inc."
"ABRpD","Arbor Realty Trust, Inc. 6.375% Series D Cumulative Redeemable Preferred Stock, Liquidation Preference $25.00 per Share"
"ABRpE","Arbor Realty Trust, Inc. 6.25% Series E Cumulative Redeemable Preferred Stock"
"ABRpF","Arbor Realty Trust, Inc. 6.25% Series F Fixed-to-Floating Rate Cumulative Redeemable Preferred Stock, Liquidation Preference $25.00 per share"
"ABSI","Absci Corporation Common Stock"
"ABT","Abbott Laboratories"
"ABTS","Abits Group Inc Ordinary Shares"
"ABUS","Arbutus Biopharma Corporation Common Stock"
"ABVC","ABVC BioPharma, Inc. Common Stock"
"ABVE","Above Food Ingredients Inc. Common Stock"
"ABVEW","Above Food Ingredients Inc. Warrants"
"ABVX","Abivax SA American Depositary Shares"
"AC","Associated Capital Group, Inc."
"ACA","Arcosa, Inc. Common Stock"
"ACAD","Acadia Pharmaceuticals Inc."
"ACB","Aurora Cannabis Inc. Common Shares"
"ACCO","Acco Brands Corporation"
"ACCS","ACCESS Newswire Inc."
"ACDC","ProFrac Holding Corp. Class A Common Stock"
"ACEL","Accel Entertainment, Inc."
"ACES","ALPS Clean Energy ETF"
"ACET","Adicet Bio, Inc. Common Stock"
"ACGL","Arch Capital Group Ltd"
"ACGLN","Arch Capital Group Ltd. Depositary Shares, each Representing a 1/1,000th Interest in a 4.550% Non-Cumulative Preferred Share, Series G"
"ACGLO","Arch Capital Group Ltd. Depositary Shares Each Representing 1/1,000th Interest in a Share of 5.45% Non-Cumulative Preferred Shares, Series F"
"ACGR","American Century Large Cap Growth ETF"
"ACGR","American Century Large Cap Growth ETF"
"ACGR","American Century Large Cap Growth ETF"
"ACHC","Acadia Healthcare Company, Inc."
"ACHR","Archer Aviation Inc."
"ACHR.WS","Archer Aviation Inc. Redeemable Warrants, each whole warrant exercisable for one Class A common stock at an exercise price of $11.50"
"ACHV","Achieve Life Sciences, Inc."
"ACI","Albertsons Companies, Inc."
"ACIC","American Coastal Insurance Corporation Common Stock"
